%FILE internal/sql-33.html
%LASTMOD
%KEY pgsql-sql33

%TITLE データの削除	DELETE 

<pre>
[<書式>]

[ WITH [ RECURSIVE ] with_query [, ...] ]
DELETE FROM [ ONLY ] table [ [ AS ] alias ]
    [ USING usinglist ]
    [ WHERE condition | WHERE CURRENT OF cursor_name ]
    [ RETURNING * | output_expression [ AS output_name ] [, ...] ]

==========================================================
パラメータ	説明
==========================================================
table_name	データを削除するテーブル名
where_condition	WHERE句による削除レコード指定の条件
==========================================================

==============================================================
句				説明
==============================================================
WITH with_query			CTE(共通テーブル式)を設定する。詳細は[<6-21>]参照。バージョン9.1から
WHERE condition			WHERE句による削除レコード指定の条件。サブクエリも使用可
WHERE CURRENT OF cursor_name	カーソルcursor_nameから最近取り出した1レコードを削除する。バージョン8.3から
RETURNING　output_expression	削除結果を表示する。バージョン8.2から
==============================================================

==========================================================
オプション	説明
==========================================================
ONLY		継承先のデータを削除しない。詳細は[<6-06>]「データ操作の継承を無効にする」を参照
==========================================================
</pre>

%CHAPTER 解説

<p>
DELETE文でテーブルのデータを削除します(ラージオブジェクトの削除はメタコマンド\lo_unlink)。
現在のところ、ビューのデータは削除できません。
<br>
DELETE文はそのテーブルのDELETE権限が必要です(権限の表示はメタコマンド\z)。
</p>

<p>
バージョン8.3から、カーソルで最近取り出した1レコードを削除できます。
実行例は[<6-39>]に示します。
</p>

%CHAPTER 実行例

<p>
・全データの削除
<br>
WHERE句を設定しない場合、指定したテーブルの全データを削除します。
</p>

<pre>
sampledb=# DELETE FROM itemlist; 
DELETE 3 
</pre>

<p>
・条件を指定して削除
<br>
WHERE句を設定し、「価格(price)が100円未満」のレコードを削除します。
</p>

<pre>
sampledb=# SELECT * FROM itemlist;
 id |   name   | price | makercode 
----+----------+-------+-----------
  1 | pen      |   100 |        10
  2 | notebook |   120 |        20
  3 | eraser   |    72 |        10
(3 rows)

sampledb=# DELETE FROM itemlist WHERE price < 100;
DELETE 1

sampledb=# SELECT * FROM itemlist;
 id |   name   | price | makercode 
----+----------+-------+-----------
  1 | pen      |   100 |        10
  2 | notebook |   120 |        20
(2 rows)
</pre>


<p>
・サブクエリ
<br>
DELETE文のWHERE句にサブクエリ([<6-29>]参照)を使います。
<br>
例として、テーブルmakerlistに含まれるデータをもとに、テーブルitemlistのデータ(ここではSmythson社の製品)を削除します。
</p>

<pre>
sampledb=# SELECT * FROM itemlist;
 id |   name   | price | makercode 
----+----------+-------+-----------
  1 | pen      |   100 |        10
  2 | notebook |   120 |        20
  3 | eraser   |    72 |        10
(3 rows)

sampledb=# SELECT * FROM makerlist;
 id |   name   
----+----------
 10 | Smythson
 20 | Rotring
(2 rows)

sampledb=# DELETE FROM itemlist
sampledb-#   WHERE makercode IN (SELECT id FROM makerlist WHERE name = 'Smythson');
DELETE 2

sampledb=# SELECT * FROM itemlist;
 id |   name   | price | makercode 
----+----------+-------+-----------
  2 | notebook |   120 |        20
(1 row)
</pre>

