%FILE internal/func-09.html
%LASTMOD
%KEY pgsql-func09

%TITLE <a href="https://www.postgresql.org/docs/current/functions-merge-support.html" target="_blank" rel="noopener noreferrer">Merge Support関数</a>

<table><tr bgcolor="#cccccc">
<th>関数</th>			<th>返り値型</th>	<th>説明</th>
</tr><tr>
<td>merge_action()</td>	<td>text</td>	<td>MERGEコマンドで実行された行数を返す。バージョン17から</td>
</tr></table>

<br>


%CHAPTER 実行例

<pre>
testdb=# SELECT * FROM tbl1;
id | data
----+------
  2 |    2
  3 |    3
  5 |    5
  7 |    7
 11 |   11
(5 rows)

testdb=# SELECT * FROM tbl2;
 id | data
----+------
  1 |    1
  2 |    2
  3 |    3
  4 |    4
  5 |    5
  6 |    6
  7 |    7
  8 |    8
  9 |    9
 10 |   10
(10 rows)

BEGIN
testdb=*# MERGE INTO tbl1
		USING tbl2 ON tbl1.id = tbl2.id
		WHEN MATCHED THEN
		     UPDATE SET data = tbl1.data + tbl2.data
		WHEN NOT MATCHED THEN
		     INSERT (id, data) VALUES (tbl2.id, tbl2.data)
		RETURNING merge_action(), tbl1.*

 merge_action | id | data
--------------+----+------
 INSERT       |  1 |    1
 UPDATE       |  2 |    4
 UPDATE       |  3 |    6
 INSERT       |  4 |    4
 UPDATE       |  5 |   10
 INSERT       |  6 |    6
 UPDATE       |  7 |   14
 INSERT       |  8 |    8
 INSERT       |  9 |    9
 INSERT       | 10 |   10
(10 rows)

MERGE 10

testdb=*# SELECT * FROM tbl1 ORDER BY id;
 id | data
----+------
  1 |    1
  2 |    4
  3 |    6
  4 |    4
  5 |   10
  6 |    6
  7 |   14
  8 |    8
  9 |    9
 10 |   10
 11 |   11
(11 rows)

</pre>
